{"$id":"https://paperworks.local/schemas/v6/llm_direct_number_evaluation_policy_v1_schema.json","$schema":"https://json-schema.org/draft/2020-12/schema","additionalProperties":false,"properties":{"arm":{"type":"string"},"artifact_hash":{"pattern":"^[a-f0-9]{64}$","type":"string"},"artifact_type":{"const":"llm_direct_number_evaluation_policy_v1","type":"string"},"budget_policy_hash":{"pattern":"^[a-f0-9]{64}$","type":"string"},"calibrated_numeric_values_given_as_answer":{"type":"boolean"},"designated_comparator":{"type":"string"},"generation_calls_per_relation":{"type":"integer"},"isolated_from_main_arms":{"type":"boolean"},"label_input_used":{"type":"boolean"},"may_replace_main_method":{"type":"boolean"},"normalized_absolute_error_formula":{"type":"string"},"numeric_origin":{"type":"string"},"policy_id":{"type":"string"},"reported_rates":{"items":{"type":"string"},"type":"array"},"runtime_authority_granted":{"type":"boolean"},"same_model_execution_policy":{"type":"boolean"},"same_prompt_family_structure":{"type":"boolean"},"same_relation_identity":{"type":"boolean"},"same_semantic_context":{"type":"boolean"},"schema_version":{"const":"1.0.0","type":"string"},"validity_authority_granted":{"type":"boolean"}},"required":["schema_version","artifact_type","policy_id","arm","designated_comparator","generation_calls_per_relation","budget_policy_hash","same_relation_identity","same_semantic_context","same_model_execution_policy","same_prompt_family_structure","calibrated_numeric_values_given_as_answer","numeric_origin","normalized_absolute_error_formula","reported_rates","isolated_from_main_arms","may_replace_main_method","validity_authority_granted","runtime_authority_granted","label_input_used","artifact_hash"],"title":"llm_direct_number_evaluation_policy_v1","type":"object"}
