{"arm":"T1-DIRECT-NUMBER","artifact_hash":"fbf9f19894090da62e3835b2ef3b65c9f2a726bb26f6673b5f50d8de0b37daed","artifact_type":"llm_direct_number_evaluation_policy_v1","budget_policy_hash":"d36e297cb1de71d4a04f4ad99a31d7c75c076d1b2d6b2ccb74905bdcf4cc1c64","calibrated_numeric_values_given_as_answer":false,"designated_comparator":"T1","generation_calls_per_relation":1,"isolated_from_main_arms":true,"label_input_used":false,"may_replace_main_method":false,"normalized_absolute_error_formula":"abs(proposed-approved)/max(abs(approved),1e-12)","numeric_origin":"llm_direct_number_ablation","policy_id":"task039e0_t1_direct_number_v1","reported_rates":["nonfinite_proposal_rate","missing_number_rate","sign_domain_violation_rate"],"runtime_authority_granted":false,"same_model_execution_policy":true,"same_prompt_family_structure":true,"same_relation_identity":true,"same_semantic_context":true,"schema_version":"1.0.0","validity_authority_granted":false}
